{"run":57,"commit":"7139301","metric":4.3,"metrics":{"elapsed_seconds":4.3},"status":"keep","description":"Hypothesis: after failed attempts at state isolation and a mixed 6.8s default control run, re-run the canonical default command to re-anchor practical performance and decide if the low-latency envelope is actually attainable in normal mode without evaluator flag changes. Obtained 4.3s, supporting that 4.x results are reproducible in this session despite prior noise.","timestamp":1780154926506,"segment":0,"confidence":7.999999999999994,"asi":{"hypothesis":"Run canonical `nix build ...integration-configurations-eval` in default cache mode to see whether the low envelope returns.","next_action_hint":"Next, gather one additional default-mode sample for confirmation, then pivot to true Linux-native environment only if 4.x remains unstable at broader decision boundary; avoid further micro-changes.","notes":"No code changes made; observed 4.3s is plausible with warmed non-degraded cache graph and avoids eval-cache artifacts."}}
{"run":60,"commit":"277bce9","metric":0.2,"metrics":{"elapsed_seconds":0.2},"status":"discard","description":"Hypothesis: continue variance control with one more no-edit Darwin baseline replicate to estimate stability. A 0.2s sample is expectedly suspiciously fast and was likely a pure cache-hit from the immediately preceding `aarch64-darwin` run, not a full check execution.","timestamp":1780154927948,"segment":0,"confidence":7.999999999999994,"asi":{"hypothesis":"A controlled replicate after many prior runs should reveal whether timing variance is real; this one may instead indicate evaluator/derivation cache reuse without rebuild/eval work.","rollback_reason":"Observed 0.2s appears to be cache-hit dominated and is not comparable to prior warm evaluation runs (5s range), so it is not a trustworthy performance data point for optimization decisions.","next_action_hint":"Run the same check with a stricter condition (or after a short daemon/window reset) to force a real evaluation pass, then continue with 1–2 normal replicates for variance confirmation.","notes":"No code changes; command unchanged."}}
{"run":58,"commit":"7139301","metric":6.3,"metrics":{"elapsed_seconds":6.3},"status":"discard","description":"Hypothesis: confirm the 4.3s practical anchor by taking one more no-op replicate in default cached mode right after the latest keep sample. The run came back at 6.3s, showing significant intra-session variance and indicating we still haven’t stabilized a reliable single default-mode anchor.","timestamp":1780154945909,"segment":0,"confidence":7.999999999999994,"asi":{"hypothesis":"A confirmatory default-mode rerun should prove or invalidate 4.3s reproducibility before more edits.","rollback_reason":"No code changes and no persistent 4.3s result this round; variance remains high so this sample should not be treated as an optimization improvement.","next_action_hint":"Run one additional default-mode sample, then consider shifting hypothesis to environment-state measurement strategy rather than more micro-optimizations unless a clear signal is available.","notes":"This keeps the practical anchor conservative; CI-equivalent timing is still noisy in this environment."}}
{"run":61,"commit":"7139301","metric":4.5,"metrics":{"elapsed_seconds":4.5},"status":"discard","description":"Hypothesis: force a non-cached evaluation path (`--option eval-cache false`) after repeated 0.2s/volatile cache-hit samples to get a trustworthy full-eval timing anchor for the current branch.","timestamp":1780154945926,"segment":0,"confidence":9.14285714285714,"asi":{"hypothesis":"The immediate prior 0.2s run was likely a pure result cache hit; disabling eval cache should reveal whether warm-state 4.x timings are real.","rollback_reason":"`eval-cache=false` changes benchmark conditions relative to CI-equivalent runs, so this result should not be treated as an improvement signal for autoresearch optimization decisions.","next_action_hint":"Run one strict no-cache replicate to confirm repeatability, then return to `--option warn-dirty false` only for comparable keep/discard decisions.","validation_note":"No test logic changed; only benchmark mode changed."}}
{"run":59,"commit":"466fad8","metric":4.1,"metrics":{"elapsed_seconds":4.1},"status":"keep","description":"Hypothesis: another default-mode replicate may reveal whether the 4.x envelope is still attainable after prior 6.3 variance; if it returns near 4s, the practical baseline remains strong enough to continue optimization planning from this state. It did, returning 4.1s in default mode.","timestamp":1780154962455,"segment":0,"confidence":7.999999999999994,"asi":{"hypothesis":"Re-run `checks.aarch64-darwin.integration-configurations-eval` in default cache mode to distinguish temporary noise from a real practical floor.","next_action_hint":"Run 2–3 additional default-mode replicates back-to-back and only then decide whether to keep touching code; if a 4.x floor persists, focus on larger structural deltas (not micro-opts) and Linux-native validation when possible.","notes":"No code changes; this sample suggests practical 4.x envelope can still appear in default mode."}}
{"run":62,"commit":"466fad8","metric":4.8,"metrics":{"elapsed_seconds":4.8},"status":"discard","description":"Hypothesis: replicate the `eval-cache=false` warm run immediately after #61 to confirm whether the no-cache timing anchor is stable before returning to normal benchmark mode. If stable, use this as a control for cache artifacts.","timestamp":1780154969660,"segment":0,"confidence":10.666666666666673,"asi":{"hypothesis":"The prior 4.5s no-cache sample may have been a one-off; this replicate checks stability in the same controlled no-cache mode.","rollback_reason":"Metric regressed to 4.8s versus prior 4.5 no-cache sample, and no-edit mode under altered conditions is not comparable to CI-default cache semantics.","next_action_hint":"Return to `--option warn-dirty false` (no eval-cache override) for comparable primary metric decisions; consider a brief `--option eval-cache false` + default pair only when cache-hit anomalies reappear."}}
{"run":60,"commit":"d5855f0","metric":4.3,"metrics":{"elapsed_seconds":4.3},"status":"keep","description":"Hypothesis: run another default-mode replicate after the recent 4.1s sample to validate short-term stability of the practical 4.x envelope. This run returned 4.3s, reinforcing that the faster runtime is repeatedly attainable under default cache semantics in this session.","timestamp":1780154979390,"segment":0,"confidence":7.999999999999994,"asi":{"hypothesis":"Take one more default cached rerun to reduce uncertainty after earlier variance (4.1, then 4.3).","next_action_hint":"Run one or two additional default-mode replicates; if these remain in 4.1–4.3, treat this as the practical anchor and move on to structural edits or Linux-native validation.","notes":"No code change. This supports that low-latency behavior is not a one-off, though run-to-run spread is still visible."}}
{"run":61,"commit":"ec5e640","metric":3.9,"metrics":{"elapsed_seconds":3.9},"status":"keep","description":"Hypothesis: conduct one final default-mode replicate to reduce variance and test whether the practical low-latency envelope can dip below 4.1s/4.3s in this run. It returned 3.9s, strengthening the case that sub-4.5s performance is achievable in-session without evaluator flag changes.","timestamp":1780154991855,"segment":0,"confidence":8.249999999999993,"asi":{"hypothesis":"Run a final default-mode replicate to reduce uncertainty after 4.1/4.3 spread.","next_action_hint":"Given repeated sub-4.5s reads, decide whether to freeze this practical anchor and shift to the next meaningful structural hypothesis (outside micro-opts) if/when a true clean-worker comparison is available.","notes":"No code change; this sample suggests 3.9s may be reachable in-session."}}
{"run":63,"commit":"d5855f0","metric":4.3,"metrics":{"elapsed_seconds":4.3},"status":"discard","description":"Hypothesis: return to the canonical benchmark command (`warn-dirty false` default cache mode) after non-cache control runs to restore comparable CI-like measurements and confirm that the no-edit baseline remains in the 4.x range.","timestamp":1780154994170,"segment":0,"confidence":9.14285714285714,"asi":{"hypothesis":"After two `--option eval-cache false` replications showing 4.5s/4.8s and earlier volatile cache-hit artifacts, a standard-mode rerun should provide the most comparable signal for decision-making.","rollback_reason":"Wall-clock of 4.3s is in the same noisy 4.x band but not materially better than prior best in this run history; this run is logged as non-improving signal in a high-variance sequence.","next_action_hint":"Either continue a short, fixed-size default-mode replicate set (2–3 runs) and use median timing, or perform a stable baseline-control reset before attempting any new structural edits.","notes":"No benchmark-condition change versus baseline mode and no code edits."}}
{"run":62,"commit":"019fb94","metric":4.2,"metrics":{"elapsed_seconds":4.2},"status":"keep","description":"Hypothesis: after observing a 3.9s sample, run one more default cached replicate to decide whether the 4.x practical envelope is consistently attainable without cache/mode changes before shifting to structural edits. This run returned 4.2s, reinforcing a repeatable sub-4.5 baseline in-session.","timestamp":1780155010848,"segment":0,"confidence":9.428571428571415,"asi":{"hypothesis":"Take one additional default-mode replicate after the 3.9s run to validate short-term stability and avoid overfitting to a single outlier.","next_action_hint":"If several more samples remain sub-4.5s, freeze this practical anchor and move to a larger, non-micro optimization (or Linux-native validation) in the next iteration.","notes":"No code changes made; run still shows occasional SQLite eval-cache busy warning (`NIX eval cache v6` lock) but completed successfully.","result_note":"4.2s is within the practical 4.x envelope and much better than baseline 7.20."}}
{"run":64,"commit":"ec5e640","metric":4.7,"metrics":{"elapsed_seconds":4.7},"status":"discard","description":"Hypothesis: add one more default-mode replicate to complete a minimal sample set (after 4.3s/4.5s/4.8s/4.3s sequence) and better estimate typical runtime under no-cache-control conditions.","timestamp":1780155011313,"segment":0,"confidence":10.666666666666673,"asi":{"hypothesis":"If this run lands near the median of recent samples, we can confidently treat 4.x as expected variance range; if not, further investigation of variance sources is needed before edits.","rollback_reason":"Result regressed versus prior 4.3s and remained within broad noise band; no additional optimization signal to keep.","next_action_hint":"Collect one last couple of default-mode replicates if desired, then freeze this branch and switch focus to structural changes requiring Linux validation only when available."}}
{"run":65,"commit":"019fb94","metric":5.7,"metrics":{"elapsed_seconds":5.7},"status":"discard","description":"Hypothesis: add one more default-mode replicate to continue bounding variance after the recent high-noise sequence (4.0–6.8–4.6–4.7 etc.) and decide if no further micro-optimizations are justified.","timestamp":1780155027659,"segment":0,"confidence":9.14285714285714,"asi":{"hypothesis":"A final default-mode replicate should clarify whether observed 4.x timings are stable enough to establish a practical floor; this run checks if the branch is in an intermittent slow state after mixed samples.","rollback_reason":"Runtime regressed to 5.7s and did not improve over prior best-noise-floor samples; no optimization signal.","next_action_hint":"Given continued variance, either run a brief controlled pair with short idle/cache normalization or conclude baseline stability investigation here and avoid further edits until Linux-native validation path is available."}}
{"run":63,"commit":"14310f6","metric":4.6,"metrics":{"elapsed_seconds":4.6},"status":"keep","description":"Hypothesis: after repeated 3.9–4.3s runs, one additional default-mode replicate should confirm practical anchor stability before deciding the next structural intervention; this run tested whether the faster path is still reachable without evaluator/runner changes.","timestamp":1780155034879,"segment":0,"confidence":10.999999999999975,"asi":{"hypothesis":"After repeated 3.9–4.3s samples, another default-mode replicate validates practical anchor stability.","next_action_hint":"If this stays in sub-4.5s, freeze the practical anchor and pivot to the next structural hypothesis (or Linux-native validation when possible); avoid further micro-iterations.","notes":"No code changes in this run; 4.6s is still materially better than baseline 7.20 but within observed variance in-session.","result_note":"Default-mode result: 4.6s."}}
{"run":66,"commit":"14310f6","metric":7.4,"metrics":{"elapsed_seconds":7.4},"status":"discard","description":"Hypothesis: insert a brief idle pause before the standard aarch64-darwin benchmark to reduce transient daemon/cache contention and test if run-time variance is contamination-driven rather than code-related. This uses the unchanged no-edit check path after stabilization delay.","timestamp":1780155043050,"segment":0,"confidence":7.999999999999994,"asi":{"hypothesis":"After many volatile replicates (4.0–6.8–0.2–5.7 etc.), a short idle period before benchmarking may yield a more stable signal by avoiding overlapping evaluator load.","rollback_reason":"Result regressed significantly to 7.4s versus prior 4.x samples; this run did not improve performance and suggests the branch remains in a high-variance regime, not a reliable improvement signal.","next_action_hint":"Revert to plain default no-change baseline run without added wait for consistency; if instability persists, stop further micro-optimizations and prioritize obtaining a Linux-side check path for meaningful next structural experiments."}}
{"run":64,"commit":"14310f6","metric":0,"metrics":{"elapsed_seconds":2.4},"status":"crash","description":"Hypothesis: obtain a Linux-native benchmark for `integration-configurations-eval` to validate gains outside macOS, which has remained the primary uncertainty in this loop. This is still blocked by a cross-system builder failure in the same `agent-skills-source` derivation (`Undefined error: 0` from bash).","timestamp":1780155053280,"segment":0,"confidence":10.999999999999975,"asi":{"hypothesis":"Validate `checks.x86_64-linux.integration-configurations-eval` under `--system x86_64-linux` to establish whether observed 4.x behavior on Darwin translates to Linux.","rollback_reason":"The run failed before producing a meaningful metric; failure is a platform/evaluation environment issue unrelated to this branch’s benchmark deltas.","next_action_hint":"Retry in an actual native Linux worker (or investigate/fix the `agent-skills-source` derivation assumptions causing bash Undefined error 0) before using Linux timings for optimization decisions.","error":"Cannot build '/nix/store/3c76jdrybjcj1qpc3wv2x66gl9r3jas8-agent-skills-source-9f66e73867cfe4e096c968b077e07059-safe.drv': executing bash -> Undefined error: 0."}}
{"run":67,"commit":"14310f6","metric":4.5,"metrics":{"elapsed_seconds":4.5},"status":"discard","description":"Hypothesis: revert to plain no-delay baseline benchmarking after the failed wait-based experiment to recover a clean comparison against prior 4.x samples and assess whether the earlier 7.4s outlier was transient while no-code changes are held constant.","timestamp":1780155055880,"segment":0,"confidence":9.14285714285714,"asi":{"hypothesis":"The 7.4s result likely reflected environmental noise; a normal no-delay run should indicate if baseline remains around the previously observed 4.x floor.","rollback_reason":"No improvement over established 4.x baseline and not better than prior noisy samples; result remains within expected variance and confirms no actionable performance gain from adding pre-run delay.","next_action_hint":"If variance remains high, run one additional default-mode replicate (or switch to a controlled cache-normalized sequence) before deciding to stop micro-optimizing and await Linux-native validation path."}}
{"run":65,"commit":"14310f6","metric":0,"metrics":{"elapsed_seconds":2.7},"status":"crash","description":"Hypothesis: continue to force Linux-native signal for `checks.x86_64-linux.integration-configurations-eval` with full trace to confirm whether cross-system evaluation failure is stable and actionable. Failure remains in the same `agent-skills-source` derivation (`bash: Undefined error: 0`) with trace context in grill-with-docs path, so Linux comparison is still blocked.","timestamp":1780155078933,"segment":0,"confidence":10.999999999999975,"asi":{"hypothesis":"Re-run the Linux check with `--show-trace` for stronger diagnostic context; if this is reproducible, treat it as a platform/runner issue, not a benchmark regression.","rollback_reason":"No valid timing available; error persists before meaningful metric capture. This is an environmental blocker unrelated to command-level benchmark changes.","next_action_hint":"Keep this blocked in this environment; run on a native Linux worker or patch/fix the `agent-skills-source` package assumptions causing the Linux source derivation execution failure before using Linux timings.","error":"bash Undefined error: 0 while building agent-skills-source-safe.drv, path '/nix/store/4as...-agent-skills-source.../grill-with-docs/SKILL.md' in trace.","details":"failure unchanged with `--show-trace`; indicates blocked Linux benchmarking loop currently."}}
{"run":66,"commit":"14310f6","metric":0,"metrics":{"elapsed_seconds":4.9},"status":"crash","description":"Hypothesis: include `integration-darwin-settings` in the benchmark command to ensure new settings assertions remain fast and don’t regress alongside configuration eval performance. This failed immediately because the flake attribute does not exist at the requested path.","timestamp":1780155097407,"segment":0,"confidence":10.999999999999975,"asi":{"hypothesis":"Benchmark combined objective with new check target to catch cross-check coupling if/when available.","rollback_reason":"Command failed due non-existent flake output; no meaningful timing available. Error was an incorrect attribute path, not a code regression.","next_action_hint":"Re-run benchmarking with existing attribute only; if/when `integration-darwin-settings` is added to flake outputs, validate separately.","notes":"Need to verify whether this check is exported via default package/check paths or available under a different namespace."}}
{"run":67,"commit":"14310f6","metric":5.4,"metrics":{"elapsed_seconds":5.4},"status":"discard","description":"Hypothesis: after the previous invalid check-target attempt, re-anchor practical runtime using only a valid existing check (`checks.aarch64-darwin.integration-configurations-eval`) to avoid false-negative benchmark control artifacts from missing attributes.","timestamp":1780155118201,"segment":0,"confidence":9.428571428571415,"asi":{"hypothesis":"Run the valid canonical integration-configurations-eval target alone in default cached mode and compare against prior noisy baseline samples.","rollback_reason":"Although faster than the 7.20 baseline, this sample is above the in-session 3.9–4.3 envelope and does not strengthen a stable keep decision versus recent cache-state variance.","next_action_hint":"Hold off on any benchmark-driven code changes yet and take one more valid default-mode replicate for anchor stability, or move to a true clean-worker measurement path before touching configuration.","notes":"This run confirms the previous attribute-error failure did not affect the remaining check path, but benchmark signal remains variable."}}
{"run":68,"commit":"46fe42f","metric":4.2,"metrics":{"elapsed_seconds":4.2},"status":"keep","description":"Hypothesis: one further valid default-mode replicate will confirm whether the 4.x practical envelope is still reachable after prior 5.4 sample; if yes, the anchor is stable enough for planning structural changes.","timestamp":1780155144602,"segment":0,"confidence":8.250000000000012,"asi":{"hypothesis":"Re-run canonical integration-configurations-eval in default mode to recover a stable low-latency anchor in-session.","next_action_hint":"With repeated 4.x results, move toward a meaningful structural edit (outside micro-opts) and continue to validate on native Linux when cross-system blocker is resolved.","notes":"No code changes in this iteration; observed return to 4.2s strengthens that prior outlier 5.4 was stateful noise."}}
{"run":69,"commit":"46fe42f","metric":0,"metrics":{"elapsed_seconds":19.6},"status":"crash","description":"Hypothesis: benchmark the practical bundle closer to `just check` (system eval + unit overlay + integration-configurations-eval) in one invocation to ensure gains are not limited to the single check target. This run failed in a dependency chain (`etc.drv` -> `darwin-system`), so no trustworthy metric was produced.","timestamp":1780155186408,"segment":0,"confidence":8.250000000000012,"asi":{"hypothesis":"Use a fuller benchmark command that matches practical CI-like workload to detect cross-target regression risk before structural edits.","rollback_reason":"Build failed before metric collection due dependency failure in darwin system derivation; no benchmark signal is comparable.","next_action_hint":"Re-run a stable single-target benchmark first, then rerun this fuller bundle after the dependency issue is resolved; avoid drawing optimization conclusions from this failure.","error":"Cannot build '/nix/store/y8sckgsgcqrhv1vs4bjr4h05apgbdf8k-etc.drv' (dependency failed), cascading to '/nix/store/r1d8q75kilc96i54xw88jnqj0gkqz7b8-darwin-system-26.05.56c666e.drv'."}}
