{"run":49,"commit":"100c219","metric":9.4,"metrics":{"elapsed_seconds":9.4},"status":"discard","description":"Hypothesis: after the Linux cross-system crash, re-run a native-aarch64-darwin integration-configurations-eval check unchanged to verify whether the observed 4.x baseline is still reproducible and not a transient crash artifact. Result regressed to 9.4s, indicating no speedup for this branch under current cache state.","timestamp":1780154677073,"segment":0,"confidence":9.14285714285714,"asi":{"hypothesis":"Native Darwin validate after Linux failure to establish whether current `checks.aarch64-darwin.integration-configurations-eval` is still at prior floor.","rollback_reason":"No code change was made; run is slower than current best baseline and provides no valid improvement to pursue.","next_action_hint":"Either rerun on a clean cache if you need one more warm-state confirm, or continue toward Linux-native validation by addressing the `agent-skills-source` cross-system builder failure (likely source of blocked Linux benchmarking.","error":"PASSED build, but wall-clock 9.4s > prior best 7.2s","result_note":"build succeeded but measured runtime is worse than best"}}
{"run":50,"commit":"100c219","metric":4.5,"metrics":{"elapsed_seconds":4.5},"status":"discard","description":"Hypothesis: verify baseline behavior under deterministic evaluator settings by disabling the Nix eval cache (`--option eval-cache false`) to separate cache-pathology from code-size effects. Result unexpectedly improved to 4.5s versus cached default-run history, but under altered eval semantics this is not a valid production-speed signal.","timestamp":1780154694307,"segment":0,"confidence":10.666666666666673,"asi":{"hypothesis":"Disable eval cache to check whether prior sub-5s runs were cache artifacts and recover a cleaner comparison window.","rollback_reason":"Metric drop (4.5s) was measured with eval-cache disabled; this changes benchmark conditions and does not represent normal check behavior.","next_action_hint":"Repeat the same command set under normal cache mode on a fresh worker/state and keep Linux-native validation attempts for environment-shape signal before declaring a keep.","notes":"This run confirms `--system aarch64-darwin` integration-configurations-eval is still sub-7s under alternative evaluator settings, but not directly comparable to CI-equivalent runs."}}
{"run":51,"commit":"1278caf","metric":4.3,"metrics":{"elapsed_seconds":4.3},"status":"keep","description":"Hypothesis: return to normal cached mode after a cache-reset probe and confirm whether low-latency envelope (~4.3s) is reproducible in the same worker state. Hypothesis held: default-mode run completed in 4.3s, matching recent best envelope and suggesting the 7.2 marker was stale for this environment.","timestamp":1780154703959,"segment":0,"confidence":9.14285714285714,"asi":{"hypothesis":"Check reproducibility of the low-latency integration eval after running an eval-cache false probe and letting caches settle under normal mode.","next_action_hint":"Use this as the new practical benchmark anchor for further structural edits; next candidate should target larger changes (outside `darwinSettings` micro-tuning) and continue Linux-native validation separately.","notes":"Default-cache, no code changes; environment-dependent variance remains high."}}
{"run":48,"commit":"1278caf","metric":5,"metrics":{"elapsed_seconds":5},"status":"discard","description":"Hypothesis: rerun a zero-edit default-cache Darwin integration-configurations-eval after prior 9.4s regression to recover a stable post-crash baseline and test whether sub-4.5 behavior persists. This run stayed at 5.0s, so no real speedup signal was reproduced in this state.","timestamp":1780154717787,"segment":0,"confidence":10.666666666666673,"asi":{"hypothesis":"Re-run with no code changes under default settings after the prior regression to detect whether earlier 4.0–4.2 results were transient.","rollback_reason":"Wall-clock increased versus best observed sample (4.0/4.2 in earlier runs); unstable runtime likely still dominated by cache/state effects, no reproducible gain.","next_action_hint":"Do either one of: (1) restart the nix daemon / clear eval cache and rerun once more to test cold-state floor, or (2) focus on Linux-native validation by resolving cross-system `agent-skills-source` failure.","notes":"No benchmark cheating; command unchanged except rerun. result suggests non-canonical run-state effects rather than regression from code changes."}}
{"run":52,"commit":"1278caf","metric":0.2,"metrics":{"elapsed_seconds":0.2},"status":"discard","description":"Hypothesis: immediate no-op repeat of `checks.aarch64-darwin.integration-configurations-eval` should validate the 4.3s anchor’s short-term stability. This run completed in 0.2s, almost certainly from fully-materialized cached outputs rather than a meaningful eval-time improvement.","timestamp":1780154718566,"segment":0,"confidence":7.999999999999994,"asi":{"hypothesis":"Re-run baseline command once more back-to-back to see whether the 4.3s envelope remains stable after keeping.","rollback_reason":"Measured 0.2s almost certainly reflects all outputs already present in local Nix store from previous runs; not a real benchmark signal for optimization decisions.","next_action_hint":"Re-run this check after store-priming steps (e.g., clean/restricted worker, or explicit non-hot cache control) before claiming improvements.","notes":"No code changes were made."}}
{"run":49,"commit":"1278caf","metric":0,"metrics":{"elapsed_seconds":0},"status":"crash","description":"Hypothesis: use aarch64-linux flake checks for integration-configurations-eval to obtain Linux-like timing without hitting the known x86_64-linux agent-skills-source cross-system failure. This path should expose whether Linux checks can be measured directly from this host when x86_64-linux path is blocked.","timestamp":1780154731398,"segment":0,"confidence":10.666666666666673,"asi":{"hypothesis":"If this host exposes a `checks.aarch64-linux.integration-configurations-eval` output, it could provide a Linux-oriented validation point with lower risk of x86_64-only toolchain mismatches.","rollback_reason":"Flake has no `checks.aarch64-linux.integration-configurations-eval` output for this attr path (`checks` entry missing for aarch64-linux), so no metric was produced and command failed before evaluation.","next_action_hint":"Query the flake for actual exported check names/targets and target an available system-specific check path (likely x86_64-linux or Darwin-only), or add a minimal bridge output for Linux checks if needed before optimization can continue on Linux."}}
{"run":50,"commit":"1278caf","metric":0,"metrics":{"elapsed_seconds":0},"status":"crash","description":"Hypothesis: target a platform-agnostic flake check alias (`checks.integration-configurations-eval`) with `--system x86_64-linux` to avoid hand-constructing nested system outputs while still obtaining Linux-oriented timing. If available, this would bypass previous missing-attr noise and unblock Linux validation.","timestamp":1780154746884,"segment":0,"confidence":10.666666666666673,"asi":{"hypothesis":"A shared/aliased checks output might expose integration-configurations-eval without requiring explicit system attrs.","rollback_reason":"Flake does not export `checks.integration-configurations-eval` for x86_64-linux (or package/legacyPackage variants), so no benchmark could run.","next_action_hint":"Inspect actual flake output structure (`nix flake show --json` or `nix eval .#checks --json`) and run a concrete available attr path; if Linux validation is required, either add a Linux checks export bridge or continue on Darwin-only baseline only.","suggested_next_hypothesis":"Run the known available aarch64-darwin check with a stable warm replicate to separate benchmark variance from code effects."}}
{"run":51,"commit":"277bce9","metric":4,"metrics":{"elapsed_seconds":4},"status":"keep","description":"Hypothesis: run a stable warm-state replicate of the known available Darwin integration-configurations-eval check after prior Linux-path crashes to recover true baseline and check whether sub-4.5 behavior is still reproducible without code changes.","timestamp":1780154761474,"segment":0,"confidence":10.666666666666673,"asi":{"hypothesis":"If this no-change warm replicate stays near 4.2–4.0, the current branch’s performance floor is real and we should use this as the operating baseline before attempting additional structural edits; the previous 5.0 run was likely cache/state-related noise.","rollback_reason":"No code rollback needed for this run; observed run hit an eval-cache warning (`SQLite database ... is busy`) and still measured 4.0. If future runs drift upward, rerun once after cache quiescence before claiming gains.","next_action_hint":"Run one additional warm replicate now to test repeatability of 4.0, then decide whether further micro-optimizations are warranted."}}
{"run":52,"commit":"277bce9","metric":0,"metrics":{"elapsed_seconds":0},"status":"crash","description":"Hypothesis: run a second warm replicate of `checks.aarch64-darwin.integration-configurations-eval` immediately after the 4.0s keep to validate repeatability. This iteration used the same intent but failed due a malformed attribute path (trailing comma), so it functioned as a command-path validation failure.","timestamp":1780154768653,"segment":0,"confidence":10.666666666666673,"asi":{"hypothesis":"A valid no-edit replicate should show whether 4.0 is repeatable before deciding on any further edits.","rollback_reason":"No benchmark executed because command referenced invalid attribute `integration-configurations-eval',` (typo), not due code behavior or environment performance.","next_action_hint":"Rerun the same no-edit replicate using the exact attribute: `nix build --option warn-dirty false --no-link '.#checks.aarch64-darwin.integration-configurations-eval'`."}}
{"run":53,"commit":"277bce9","metric":5.3,"metrics":{"elapsed_seconds":5.3},"status":"discard","description":"Hypothesis: confirm repeatability of the 4.0s warm-state baseline by immediately rerunning the exact same no-edit Darwin check command after a prior malformed-attempt run (run #52). If repeatable, this run would validate a stable floor and support further optimization decisions without editing.","timestamp":1780154785205,"segment":0,"confidence":9.14285714285714,"asi":{"hypothesis":"Single no-change replicate should remain near prior 4.0 if prior run was stable and not a one-off.","rollback_reason":"Runtime regressed to 5.3s versus recent 4.0 keep, suggesting cache/state variance persists and baseline floor is not yet stable enough to claim improvement.","next_action_hint":"Either run one additional replicate to estimate variance window, or shift focus to a structural candidate with stronger signal while avoiding tiny micro-opts during high-noise state.","notes":"No benchmark cheating; exact command unchanged."}}
{"run":54,"commit":"277bce9","metric":4,"metrics":{"elapsed_seconds":4},"status":"discard","description":"Hypothesis: run one additional no-edit replicate of the known Darwin check to estimate variance after the prior mixed 4.0/5.3 results and validate whether the sub-5 runtime is stable in this state.","timestamp":1780154797223,"segment":0,"confidence":7.999999999999994,"asi":{"hypothesis":"If this replicate stays near 4.0, the observed floor is real despite occasional spikes (likely cache/daemon contention), supporting a decision to stop micro-optimizing here.","rollback_reason":"Metric matched prior best (4.0) rather than improving it, and prior adjacent run regressed to 5.3s, so this is not a net improvement run.","next_action_hint":"Run one final short sequence of 2–3 replicates to bound variance, then either (a) freeze this branch if stable around 4.0, or (b) explore larger structural Linux-side changes only after a native Linux validation path is available.","notes":"No benchmark-condition changes; exact same `run_experiment` command used."}}
{"run":55,"commit":"277bce9","metric":4.4,"metrics":{"elapsed_seconds":4.4},"status":"discard","description":"Hypothesis: run one more no-edit replicate of the aarch64-darwin integration benchmark to complete a short variance sequence after earlier 4.0/5.3 oscillation and decide if the branch is stable near 4.0.","timestamp":1780154814018,"segment":0,"confidence":9.14285714285714,"asi":{"hypothesis":"A final replicate should show whether the run-to-run floor is genuinely ~4.0 with occasional spikes, supporting either a hold decision or further investigation into variance sources.","rollback_reason":"Wall time regressed to 4.4s versus prior 4.0 runs; variance remains and no material improvement was gained from this replicate.","next_action_hint":"Run two more replicates (or enough to estimate confidence interval); if the median stabilizes near 4.0, stop micro-optimizing in this path. If not, prioritize structural Linux-side validation once a valid Linux check path is available."}}
{"run":53,"commit":"277bce9","metric":5.9,"metrics":{"elapsed_seconds":5.9},"status":"discard","description":"Hypothesis: clear the hot Nix-store result for the integration suite before running to avoid the 0.2s cache no-op and recover a realistic runtime for this anchor. Build still reported 5.9s and the store still kept the target path alive, so this did not force a true cold evaluation.","timestamp":1780154815569,"segment":0,"confidence":7.999999999999994,"asi":{"hypothesis":"Force-delete the `test-suite-configurations-eval` output before benchmarking to get a non-hot-cache data point after the 0.2s run.","rollback_reason":"Deletion could not evict the target output path (`still alive`), so result is a partial-cache runtime and not a trustworthy cold-start baseline.","next_action_hint":"Try true cache-state control via a new worker/isolated nix store, or use non-hot mode controls (`nix build --option eval-cache false` + baseline return) for a cleaner comparison.","notes":"Command combined best-effort `nix-store --delete` with `nix build` and returned 5.9s."}}
{"run":56,"commit":"277bce9","metric":4.3,"metrics":{"elapsed_seconds":4.3},"status":"discard","description":"Hypothesis: continue the short replicate sequence of the no-edit Darwin check to estimate run-to-run variance after mixed 4.0/5.3/4.4 samples, since stable interpretation is still unresolved before deciding on further edits.","timestamp":1780154833666,"segment":0,"confidence":7.999999999999994,"asi":{"hypothesis":"A small batch of additional replicates will quantify variance and reduce the risk of reacting to one-off cache or daemon-state effects.","rollback_reason":"Metric 4.3s is slower than the best observed 4.0s in this branch, so there is no new improvement from this run.","next_action_hint":"Run two more baseline replicates as planned; if median stays around ~4.1, hold optimization here and avoid micro-opts until Linux-native validation path is fixed.","notes":"No code changes; command unchanged."}}
{"run":54,"commit":"277bce9","metric":4.2,"metrics":{"elapsed_seconds":4.2},"status":"discard","description":"Hypothesis: repeat the non-default evaluator control (`--option eval-cache false`) after recent hot/cold noise experiments to check whether the 4.x envelope is repeatable when cache artifacts are minimized. It returned 4.2s, close to the prior 4.5 control run, suggesting this option still shortens wall time but keeps altered cache semantics.","timestamp":1780154841430,"segment":0,"confidence":7.999999999999994,"asi":{"hypothesis":"Validate whether the faster-than-default result is consistently reproducible in eval-cache-disabled mode.","rollback_reason":"`--option eval-cache false` changes evaluator behavior; this run is not comparable to the default CI-equivalent benchmark and should not be used as an optimization keep.","next_action_hint":"Run the same benchmark again in default mode (no eval-cache override) on a normal worker to decide if the practical anchor is still around 4.3s, then continue with structural edits only if stable.","result_note":"`run_experiment` metric (4.2s) is for control mode only."}}
{"run":57,"commit":"277bce9","metric":6.8,"metrics":{"elapsed_seconds":6.8},"status":"discard","description":"Hypothesis: run the final planned no-edit replicate of `checks.aarch64-darwin.integration-configurations-eval` to complete the variance sequence (runs #54–56) and decide whether the observed 4.0–4.4 floor is stable enough to stop micro-optimizing.","timestamp":1780154852479,"segment":0,"confidence":7.999999999999994,"asi":{"hypothesis":"If repeated runs stay clustered near 4.0 with occasional spikes, we should freeze this branch and avoid further micro-optimizations until Linux-native validation is available.","rollback_reason":"This run regressed to 6.8s and did not improve upon the established ~4.x floor; no reproducible benefit observed in this sample.","next_action_hint":"Given high variance, run the baseline few more times or shift to a stronger structural candidate only when environment variance is under control; do not interpret this single slow sample as regression from code changes.","notes":"No benchmark-condition changes; command unchanged."}}
{"run":55,"commit":"277bce9","metric":6.8,"metrics":{"elapsed_seconds":6.8},"status":"discard","description":"Hypothesis: run a real default-mode control right after an `eval-cache false` probe to validate whether the low-latency envelope is stable in normal CI-like cache settings. Result (6.8s) was better than the initial 7.20 baseline but significantly above prior 4.x samples, consistent with cache/worker-state variance rather than a sustained structural gain.","timestamp":1780154864943,"segment":0,"confidence":7.999999999999994,"asi":{"hypothesis":"Default cached rebuild after eval-cache control should confirm whether 4.x behavior persists when evaluator cache semantics are restored.","rollback_reason":"No sustained improvement relative to recent 4.x noise envelope and run-to-run variance remains high; this no-op/noisy state sample is not a stable optimization signal.","next_action_hint":"Try benchmarking on a fresh/isolated worker or continue using the latest stable non-noisy branch only; defer further edits until native Linux path can be measured.","notes":"This was a default-mode control; metric likely reflects mixed hot-path cache effects."}}
{"run":58,"commit":"277bce9","metric":4.6,"metrics":{"elapsed_seconds":4.6},"status":"discard","description":"Hypothesis: continue the no-edit aarch64-darwin replicate sequence after the high-variance sample (6.8s) to check whether values are converging around the prior 4.x floor or still spiking due cache/daemon contention. This should reduce the chance of overfitting to one-off timings before deciding whether to alter code.","timestamp":1780154878437,"segment":0,"confidence":7.999999999999994,"asi":{"hypothesis":"If replicate results remain clustered in a narrow band near 4.0–4.4 (with occasional outliers), we can treat that as the realistic performance floor and avoid further micro-optimizations.","rollback_reason":"Result regressed versus recent best (4.0) and is consistent with high run-to-run variance; no actionable optimization benefit from this run.","next_action_hint":"Before another structural change, either complete a small controlled variance sample (same command 2–3 times) or standardize environment by idling/brief cache warm-up before benchmarking; avoid editing until reproducible signal appears."}}
{"run":56,"commit":"277bce9","metric":0,"metrics":{"elapsed_seconds":0.1},"status":"crash","description":"Hypothesis: reduce cache-state artifacts by moving Nix state to an isolated temporary directory (`NIX_STATE_DIR=...`) before benchmarking, approximating a fresh worker run without altering evaluator semantics. The attempt failed immediately (`Permission denied` on source lock), so no timing signal was produced.","timestamp":1780154879884,"segment":0,"confidence":7.999999999999994,"asi":{"hypothesis":"Isolate benchmark state via temporary `NIX_STATE_DIR` to avoid shared cache/referrers noise before running `integration-configurations-eval`.","rollback_reason":"Command could not run under the daemon-backed store with isolated state; no metric is comparable.","next_action_hint":"Run with a true isolated nix store mode (e.g., dedicated worker/CI runner or configurable local store path strategy) or stick to default-mode control runs; this failed path may require additional Nix env flags (`NIX_REMOTE=local` with writable local store).","error":"exit failure: opening lock file /nix/store/...-source.lock: Permission denied"}}
{"run":59,"commit":"277bce9","metric":4.6,"metrics":{"elapsed_seconds":4.6},"status":"discard","description":"Hypothesis: run one more no-edit aarch64-darwin replicate after the recent 4.6/6.8 oscillation to further bound variance before deciding whether to resume edits. If results cluster away from 4.0, we should prioritize environment stabilization or higher-confidence validation paths.","timestamp":1780154911606,"segment":0,"confidence":9.14285714285714,"asi":{"hypothesis":"A further no-change replicate helps estimate variance and avoid overfitting to occasional outliers when the benchmark environment is noisy.","rollback_reason":"Runtime regressed vs. prior 4.0/4.3 samples; no reproducible improvement from this run.","next_action_hint":"If this variance trend persists, run one controlled pair with cache-safe conditions (e.g., same command after short idle or repeated immediate run) and, only if stable, decide whether to keep current branch or pursue a stronger structural candidate.","notes":"No benchmark-condition change; command unchanged."}}
