{"run":2,"commit":"0555acc","metric":7.2,"metrics":{"elapsed_seconds":7.2},"status":"discard","description":"Hypothesis: replace NUR input with nixpkgs crush package and remove NUR overlay from flake overlays.","timestamp":1780137328762,"segment":0,"confidence":null,"asi":{"hypothesis":"NUR adds flake indirection and lock overhead; switching to nixpkgs.crush should lower benchmark.","rollback_reason":"Iteration was slower than baseline.","next_action_hint":"Try platform-specific partitioning of integration tests before reverting this change."}}
{"run":3,"commit":"0555acc","metric":8.8,"metrics":{"elapsed_seconds":8.8},"status":"discard","description":"Iteration 3 hypothesis: partition integration-configurations-eval assertions by platform to avoid evaluating non-native hosts in each check.","timestamp":1780137384937,"segment":0,"confidence":null,"asi":{"hypothesis":"Skipping non-native host assertions in integration test should reduce evaluation work on each platform.","rollback_reason":"First-run wall time increased vs baseline (8.8s vs 5.8s) with subsequent 0.2s hot-cache run; not a stable improvement.","next_action_hint":"If wanting to continue, gather colder metrics via fresh worker or compare from clean cache before deciding; otherwise keep check split but maybe not this way."}}
{"run":4,"commit":"0555acc","metric":6.7,"metrics":{"elapsed_seconds":6.7},"status":"discard","description":"Iteration 4 hypothesis: avoid eager eval of multi-system checks by switching to explicit checks attrset with dynamic keys instead of genAttrs.","timestamp":1780137430265,"segment":0,"confidence":null,"asi":{"hypothesis":"Using explicit checks attrset should evaluate only aarch64-darwin checks when that path is selected, reducing evaluation work.","rollback_reason":"No improvement in first sampled run (6.7s vs 5.8s baseline); subsequent warmed run not indicative.","next_action_hint":"Try reducing expensive evaluation in integration test by avoiding repeated self reference patterns, e.g., passing `self` not as full attrset."}}
{"run":5,"commit":"ce3e569","metric":4.8,"metrics":{"elapsed_seconds":4.8},"status":"keep","description":"Hypothesis: split integration-configurations-eval into platform-selected assertions via evalScope, passing only platform configs from tests/default so each check evaluates only relevant branch.","timestamp":1780137516983,"segment":0,"confidence":1.1111111111111107,"asi":{"hypothesis":"Conditionally selecting darwin/linux assertion sets should avoid evaluating non-native host configs in the integration test on each check platform.","next_action_hint":"Keep darwin/linux split and consider passing only needed attrs to other heavy tests as well (or caching shared helpers) for incremental gains."}}
{"run":6,"commit":"607cc40","metric":4.5,"metrics":{"elapsed_seconds":4.5},"status":"keep","description":"Hypothesis: pass explicit integration eval inputs only via *_Input and *_SystemInput and avoid resolving unused cross-platform configs by gating config bindings on selectedScope.","timestamp":1780137597688,"segment":0,"confidence":1.083333333333333,"asi":{"hypothesis":"Avoiding unconditional cross-platform self lookups and unused fallback bindings should reduce evaluation work on Darwin check.","next_action_hint":"Also avoid passing duplicate *_SystemInput if unused by refactoring to use config objects directly or a mode-specific attrset.","rollback_hint":"If regression appears on Linux path, keep previous branching with platform-specific args but retain explicit input names."}}
{"run":7,"commit":"351e762","metric":4.3,"metrics":{"elapsed_seconds":4.3},"status":"keep","description":"Hypothesis: pass full platform configuration objects into integration test and derive both config/system from that object, eliminating duplicate *_Config/*_System input plumbing.","timestamp":1780137665007,"segment":0,"confidence":1.153846153846154,"asi":{"hypothesis":"Passing whole nixos/darwin configuration attrsets (instead of separate Config vs System args) reduces attrset argument churn and avoids duplicated evaluation paths, while keeping scope gating explicit.","next_action_hint":"Run the same scoped benchmark on Linux CI matrix when available, then consider folding home-check generation into a narrower machine-specific function to further trim eval graph for each scope.","rollback_reason":""}}
{"run":8,"commit":"351e762","metric":5.4,"metrics":{"elapsed_seconds":5.4},"status":"discard","description":"Hypothesis: split nixos host assertions by native architecture (x86_64-linux vs aarch64-linux) while passing only relevant host configs in non-Darwin test invocation.","timestamp":1780137747967,"segment":0,"confidence":1.3636363636363635,"asi":{"hypothesis":"Evaluating all nixos hosts together still forces more checks on each Linux system; scope by host family should reduce per-system eval work and avoid unnecessary cross-host attr forcing.","rollback_reason":"Observed slower runtime on Darwin validation run (5.4s vs best 4.3s); also changes Linux coverage shape and test names.","next_action_hint":"Revert split or keep a simpler scoped list while preserving single-host inputs, then explore a different low-level optimization (e.g., avoid reconstructing duplicated package-absence assertions via helper predicates) without changing host partitioning."}}
{"run":9,"commit":"351e562","metric":7.9,"metrics":{"elapsed_seconds":7.9},"status":"discard","description":"Hypothesis: pass only platform-relevant Linux host configuration objects from tests/default and make nixosChecks host assertions conditional on non-null host configs to avoid evaluating irrelevant host checks.","timestamp":1780137832828,"segment":0,"confidence":1.153846153846154,"asi":{"hypothesis":"If Linux systems only need one host per worker architecture, slicing integration inputs by platform plus conditional check blocks should reduce per-platform evaluation burden and keep Darwin behavior unchanged.","rollback_reason":"On aarch64-darwin, this change regressed to 7.9s (after cold eval) versus prior best 4.3s, likely due extra list-shape churn from conditional assembly.","next_action_hint":"Prefer the prior simpler `nixos`-all-hosts path and focus on smaller code-shape optimizations (e.g., avoid `lib.filter`/`builtins.all` helper overhead) if any further improvement is needed."}}
{"run":10,"commit":"351e762","metric":5.2,"metrics":{"elapsed_seconds":5.2},"status":"discard","description":"Hypothesis: pass only architecture-relevant Linux host configuration inputs from tests/default (nixos-x86_64-linux vs nixos-aarch64-linux) and make nixosChecks host assertions conditionally include only non-null configs.","timestamp":1780137893586,"segment":0,"confidence":1.3636363636363635,"asi":{"hypothesis":"Avoid passing unused host configs/hosting cross-platform assertions in each architecture to trim integration eval while keeping Darwin checks unchanged; simpler conditional blocks may reduce both evaluation graph and CI runtime.","rollback_reason":"On aarch64-darwin, benchmark regressed to 5.2s vs prior best 4.3s, likely from additional conditional list-shape overhead.","next_action_hint":"If this direction is still pursued, benchmark directly on native Linux builders rather than inferring from Darwin; if unavailable, revert and focus on smaller reductions in Darwn path only."}}
{"run":11,"commit":"351e762","metric":4.7,"metrics":{"elapsed_seconds":4.7},"status":"discard","description":"Hypothesis: partition nixos checks by architecture via evalScope (`nixos-x86_64-linux` vs `nixos-aarch64-linux`) while retaining full checks inside dedicated nixosChecks variants.","timestamp":1780137923905,"segment":0,"confidence":1.666666666666666,"asi":{"hypothesis":"Architectural partitioning of host coverage should reduce eval graph per Linux builder while preserving full Darwin behavior, by using separate `nixosChecksX86`/`nixosChecksAarch64` and selecting by evalScope.","rollback_reason":"On this aarch64-darwin benchmark run, added host-partitioning and extra branch structure regressed to 4.7s (from best 4.3s), suggesting list-branch refactor overhead outweighs any savings in this evaluation path.","next_action_hint":"Keep Darwin-path-centric baseline optimization and defer host-architecture partitioning until native Linux CI measurements are possible."}}
{"run":12,"commit":"351e762","metric":4.6,"metrics":{"elapsed_seconds":4.6},"status":"discard","description":"Hypothesis: simplify scope gating in integration test by selecting darwin/nixos path based on whether host-specific inputs are provided, removing evalScope/selectedScope branches and unnecessary host-guarded config extraction.","timestamp":1780137951721,"segment":0,"confidence":1.9999999999999976,"asi":{"hypothesis":"Eliminating evalScope string dispatch and selectedScope conditionals should reduce eval graph size on both darwin and linux callers by relying on explicit input presence for branch selection.","rollback_reason":"Darwin benchmark regressed to 4.6s (vs prior best 4.3s).","next_action_hint":"Given limited delta, focus on smaller, orthogonal reductions in nixos host config shape only when native Linux benchmarks are available."}}
{"run":13,"commit":"63c6d2a","metric":4.3,"metrics":{"elapsed_seconds":4.3},"status":"keep","description":"Hypothesis: cache home package membership lookups inside homeChecks by precomputing per-host package-name set, avoiding repeated `lib.any` scans for each package assertion.","timestamp":1780138000775,"segment":0,"confidence":2.1428571428571423,"asi":{"hypothesis":"Repeated `hasPackage` calls in `homeChecks` re-scan `homeConfig.home.packages` for each assertion; building one set of package names per host should reduce eval overhead in configuration checks.","rollback_reason":"","next_action_hint":"If this keeps, validate with additional runs (especially on native Linux check variants) to ensure no regression and that package lookups still match expected behavior with unusual package lists.","next_step":"Explore similar precompute patterns for `darwinHome`/nixos checks (e.g., program/source maps) and keep only if noise-adjusted gains hold."}}
{"run":14,"commit":"63c6d2a","metric":4.9,"metrics":{"elapsed_seconds":4.9},"status":"discard","description":"Hypothesis: cache package membership sets for all relevant host package lists once at file scope (darwin system/home + nixos host home packages) and thread them into homeChecks and nixos assertions, reducing repeated `hasPackage` scans.","timestamp":1780138050706,"segment":0,"confidence":2.307692307692308,"asi":{"hypothesis":"The previous optimization moved `hasPackage` to precomputed host-local set checks in homeChecks; extending this to all integration assertions should avoid repeated linear scans and also reduce attrset churn in other package assertions.","rollback_reason":"Full integration eval regressed to 4.9s on aarch64-darwin versus 4.3s best, likely due extra package-set construction in branch-unselected paths and/or no material reduction in evaluated checks.","next_action_hint":"Try a narrower variant: keep homeChecks precompute and only replace package assertions in the currently executed check path while avoiding global construction of potentially unused package sets."}}
{"run":15,"commit":"63c6d2a","metric":4.9,"metrics":{"elapsed_seconds":4.9},"status":"discard","description":"Hypothesis: replicate the keep optimization on a second run to validate stability of the package-set precompute in `homeChecks`; confirm whether prior 4.3s win is consistent or cache-noise.","timestamp":1780138073221,"segment":0,"confidence":3,"asi":{"hypothesis":"Run #13 achieved 4.3s, but without external warm/cold control and on this host repeated runs may vary; this run tests repeatability before proceeding to additional structural changes.","rollback_reason":"Second replicate regressed to 4.9s, suggesting the 4.3s result may have been a cold-cache or transient fluctuation.","next_action_hint":"Do one additional warm run with explicit cache clear strategy if possible, then consider whether to keep the optimization or return to previous baseline for safe improvements; avoid making further changes on potentially noisy data."}}
{"run":16,"commit":"63c6d2a","metric":5,"metrics":{"elapsed_seconds":5},"status":"discard","description":"Hypothesis: avoid the two-pass home package set build in `homeChecks` by deriving the name set in one pass (`map` from package derivations directly).","timestamp":1780138095148,"segment":0,"confidence":3.333333333333332,"asi":{"hypothesis":"Current keep path still rebuilds home package names via `map lib.getName` then another `map` to attrs; removing one intermediate list may shave tiny eval overhead.","rollback_reason":"Single-pass refactor regressed to 5.0s versus best-known, indicating effect is within/noise and likely not beneficial.","next_action_hint":"Return to the stable known-good state and validate cross-platform behavior before further micro-optimizations."}}
{"run":17,"commit":"63c6d2a","metric":5.3,"metrics":{"elapsed_seconds":5.3},"status":"discard","description":"Hypothesis: cache darwin system package list as a set in the darwinChecks branch (and reuse it for dropbox/hammerspoon assertions) while keeping `hasPackage` polymorphic to support existing list-based call sites.","timestamp":1780138149509,"segment":0,"confidence":3.749999999999997,"asi":{"hypothesis":"Selective package-set precompute in the hot Darwin check path should avoid repeated linear scans for system-package assertions with minimal extra overhead, while keeping homeChecks’ local package set optimization.","rollback_reason":"Observed regression to 5.3s on this benchmark run; additional set conversion cost outweighed any gain versus prior baseline.","next_action_hint":"Given several regressions after this line of package-set refactors, consider freezing package-membership optimization scope and exploring other independent micro-optimizations (e.g., helper/lists in assertion assembly) only if they are expected to reduce structural overhead."}}
{"run":18,"commit":"63c6d2a","metric":4.5,"metrics":{"elapsed_seconds":4.5},"status":"discard","description":"Hypothesis: cache darwin system packages as a single attrset within `darwinChecks` and use set lookups for `dropbox`/`hammerspoon` assertions, keeping the keeped `homeChecks` package precompute untouched.","timestamp":1780138175889,"segment":0,"confidence":3.333333333333332,"asi":{"hypothesis":"This targets the two repeated system-package linear scans in the active Darwin branch with one-time set construction; if effective, it should reduce a small amount of repeated traversal in the hot path.","rollback_reason":"On this run, latency regressed to 4.5s vs best-known 4.3s from the prior package-cache keep, so regression is still above the best baseline.","next_action_hint":"Return to the minimal keep state (`homeChecks` package set only) and explore a non-overlapping micro-optimization (e.g., local `homeProgram` aliases) if additional gains are still sought."}}
{"run":19,"commit":"63c6d2a","metric":4.4,"metrics":{"elapsed_seconds":4.4},"status":"discard","description":"Hypothesis: re-run the kept `homeChecks` package-set optimization from run #13 as a clean repetition to validate stability before further changes.","timestamp":1780138197296,"segment":0,"confidence":3.749999999999997,"asi":{"hypothesis":"The prior 4.3s result may have been influenced by cache state; this run checks whether the keep gains hold on a fresh sequence.","rollback_reason":"Did not reproduce 4.3s target; runtime regressed to 4.4s, so the prior keep should not be considered stable enough to adopt alone.","next_action_hint":"Either continue with a different structural optimization (e.g., minimize repeated attribute traversals inside `homeChecks`) or defer until Linux-native measurements are available."}}
{"run":20,"commit":"9870df8","metric":4.3,"metrics":{"elapsed_seconds":4.3},"status":"keep","description":"Hypothesis: hoist repeated Home Manager sub-attribute accesses inside `homeChecks` into local bindings (`homeData`, `homePrograms`, `homeActivation`, `homeXdg`) to reduce repeated attr-path lookup overhead.","timestamp":1780138239241,"segment":0,"confidence":3.333333333333332,"asi":{"hypothesis":"`homeChecks` is invoked for every checked host and currently performs many repeated `homeConfig.programs`, `homeConfig.home`, and `homeConfig.home.activation` lookups; local bindings could shave small amounts of eval work in this hot path.","next_action_hint":"If kept, validate on another run and then on a Linux-native check target to ensure improvements are stable and not Darwin-only noise.","rollback_reason":""}}
{"run":21,"commit":"9870df8","metric":6.1,"metrics":{"elapsed_seconds":6.1},"status":"discard","description":"Hypothesis: hoist repeated NixOS host-level attribute paths in `nixosChecks` into local bindings (`wslPrograms`, `wslNetworking`, etc.) to reduce repeated attr-path lookups in the hot Linux assertions.","timestamp":1780138293394,"segment":0,"confidence":3,"asi":{"hypothesis":"`nixosChecks` reads `wslConfig.programs`, `networking`, and `wsl`/`x230`/`vm` fields repeatedly; introducing local aliases should shorten Nix expression traversal and lower eval cost.","rollback_reason":"Did not improve—runtime regressed substantially to 6.1s, likely due larger attrset/lambda let expansion and extra host binding noise.","next_action_hint":"Revert to #20 keep state and resume micro-opts only in areas with lower risk of expanding bound variable graph; additionally, run a second validation pass of keep without further edits to confirm true floor."}}
{"run":22,"commit":"9870df8","metric":4.7,"metrics":{"elapsed_seconds":4.7},"status":"discard","description":"Hypothesis: replicate the current keep change from #20 (home sub-attribute aliasing) to validate stability on a clean run after reverting a failed variant.","timestamp":1780138304756,"segment":0,"confidence":3.333333333333332,"asi":{"hypothesis":"If the 4.3s result from #20 is stable, it should hold on repeated runs; this run checks for regression/noise after intervening failed edits.","rollback_reason":"Second replicate returned 4.7s, indicating significant variance and making the 4.3s outcome less stable than initially observed.","next_action_hint":"Given unstable timing without code changes, keep #20 only if we can justify as best of available samples or revert to earlier stable keep if a more reproducible candidate appears; prioritize testing variants with larger structural differences or skip further micro-opts due noise."}}
{"run":23,"commit":"9870df8","metric":5.3,"metrics":{"elapsed_seconds":5.3},"status":"discard","description":"Hypothesis: in `nixosChecks`, precompute package-name attrsets for `wslHome`, `x230Home`, and `vmHome` only for Linux package assertions, replacing three repeated linear `hasPackage` scans with `builtins.hasAttr` lookups.","timestamp":1780138325252,"segment":0,"confidence":3.749999999999997,"asi":{"hypothesis":"Package-assertion hotspots in nixosChecks (`sourcegraph-amp`, `zed-nightly-bin`) were rewritten to O(1) attr lookups after building tiny local sets, which should reduce list scans for each host.","rollback_reason":"Did not improve and regressed to 5.3s; set-construction overhead outweighed any list-scan reduction in this evaluation path.","next_action_hint":"Return to keep state and avoid further micro-optimizations in hot loops unless larger structural improvements are identified; prioritize benchmarking with a stable methodology (e.g., controlled cache state) if available."}}
{"run":24,"commit":"9870df8","metric":4.6,"metrics":{"elapsed_seconds":4.6},"status":"discard","description":"Hypothesis: add further local binding for `homePrograms.agent-skills` (`homeSkillConfig`) inside `homeChecks` to avoid repeated deep agent-skills attribute-path traversals across many assertions.","timestamp":1780138341878,"segment":0,"confidence":3.749999999999997,"asi":{"hypothesis":"`homeChecks` contains many repeated accesses of `homePrograms.agent-skills`; binding this subtree once should marginally cut repeated attr lookups in the hot per-host home-check path.","rollback_reason":"Result was slower (4.6s) than prior best on this state, so this deeper aliasing did not help in current environment.","next_action_hint":"Stop accumulating nested local aliases unless larger gains observed; focus on meaningful structural changes or stabilize measurement methodology."}}
{"run":25,"commit":"9870df8","metric":4.7,"metrics":{"elapsed_seconds":4.7},"status":"discard","description":"Hypothesis: run a third clean replication of #20 keep state to check for transient 4.3s result and confirm variance before pursuing further modifications.","timestamp":1780138353791,"segment":0,"confidence":3.749999999999997,"asi":{"hypothesis":"Previous two repeats of the current keep showed 4.4–4.7s; another run may indicate if 4.3s was a one-off cache artifact before deciding to continue optimization or hold.","rollback_reason":"Third replicate remains 4.7s; 4.3s remains a likely noise artifact rather than stable improvement.","next_action_hint":"Given repeated instability and no clear beneficial changes, pivot to a more substantial optimization candidate (if any) or pause to avoid overfitting to benchmark noise."}}
