{"run":26,"commit":"9870df8","metric":2.5,"metrics":{"elapsed_seconds":2.5},"status":"discard","description":"Hypothesis: run the same scoped benchmark on a native Linux output (`checks.x86_64-linux.integration-configurations-eval`) to validate whether prior keep/state changes hold on Linux and avoid Darwin-only noise.","timestamp":1780138447252,"segment":0,"confidence":3.3333333333333353,"asi":{"hypothesis":"Native Linux timing should better reflect NixOS-side gains from the integration-configurations-eval refactors and provide a lower-noise signal for host-scope optimizations.","rollback_reason":"Build failed due platform mismatch in `home-manager.users.martinfan.programs.agent-skills.bundlePath` while evaluating x86_64-linux check on aarch64-darwin (`agent-skills-source` drv requires x86_64-linux).","next_action_hint":"Re-run this on a native Linux CI runner instead of emulated/macOS cross-system checkout; defer Linux-only optimization validation until that environment is available."}}
{"run":27,"commit":"9870df8","metric":5,"metrics":{"elapsed_seconds":5},"status":"discard","description":"Hypothesis: force-disable the Nix eval cache during the integration check run to remove build-time cache effects and check whether the prior 4.x results were cache artifacts.","timestamp":1780138478849,"segment":0,"confidence":3.749999999999997,"asi":{"hypothesis":"Repeated unstable times suggest cache warmness is influencing variance; disabling eval-cache should produce a cleaner signal for whether `homeChecks` precompute changes truly improve evaluation speed.","rollback_reason":"This run used `--option eval-cache false`, which changes measurement conditions relative to normal CI and should not be treated as a production metric by itself.","next_action_hint":"Follow with a comparable default-cache run after a cold/clean invocation (or after restarting daemon) to decide if any keep candidates are truly stable."}}
{"run":28,"commit":"f125ffb","metric":5.6,"metrics":{"elapsed_seconds":5.6},"status":"keep","description":"Hypothesis: run a matched default-cache control immediately after a previous `--option eval-cache false` run to test if the `4.3s–4.5s` outliers were cache artifacts and recover a representative baseline.","timestamp":1780138507098,"segment":0,"confidence":3.749999999999997,"asi":{"hypothesis":"The prior no-cache run changed measurement conditions; a follow-up default-cache run in the same session checks whether the apparent speed gains are robust under normal CI-equivalent settings.","next_action_hint":"Keep `nix build .#checks.aarch64-darwin.integration-configurations-eval --no-link` as the comparison baseline, then only pursue further code edits if default runs are consistently below 5.8 for multiple iterations."}}
{"run":29,"commit":"023f7e9","metric":4.8,"metrics":{"elapsed_seconds":4.8},"status":"keep","description":"Hypothesis: perform a direct replicate of the default-cache control run (run #28 equivalent) to estimate noise and confirm the post-no-cache stabilization signal.","timestamp":1780138518767,"segment":0,"confidence":3.749999999999997,"asi":{"hypothesis":"If the control run is stable under repeated execution, `integration-configurations-eval` has a real lower floor than 5.8; replication is needed to distinguish cache/cache-state artifacts from structural gains.","next_action_hint":"Run one more replicate and only pursue code changes if at least two consecutive default-cache runs stay below 5.0 on this host; otherwise treat 5.0–5.8 as noise envelope and stop micro-optimizations."}}
{"run":30,"commit":"1cdbae5","metric":4.2,"metrics":{"elapsed_seconds":4.2},"status":"keep","description":"Hypothesis: run one more replicate of the default-cache benchmark to verify whether repeated evaluations have converged near a lower, stable latency under normal settings.","timestamp":1780138526704,"segment":0,"confidence":3.5555555555555567,"asi":{"hypothesis":"A third replicate reduces uncertainty after the recent 5.6->4.8->4.8 sequence; sustained sub-5s results would justify treating 5.8 as stale baseline for this host and moving on to structural hypotheses.","next_action_hint":"If a fourth replicate remains sub-5s, resume structural optimization candidates (e.g., `darwinChecks` path aliasing and reduced package-lookups) on the same branch; otherwise treat this as cache churn noise."}}
{"run":31,"commit":"faf6c2a","metric":4.2,"metrics":{"elapsed_seconds":4.2},"status":"keep","description":"Hypothesis: a fourth replicate to confirm convergence; if stable, shift from noise investigation to next structural optimization candidate.","timestamp":1780138533261,"segment":0,"confidence":3.1999999999999993,"asi":{"hypothesis":"Two consecutive 4.2s runs would imply cache warmth is not the main factor and that the effective baseline on this host is much lower than the historical 5.8s marker.","next_action_hint":"Begin testing the most promising structural candidate from `latest next:` history: reintroduce targeted `darwinChecks` local aliasing around repeated attr-path reads, but only if this run also confirms stability."}}
{"run":32,"commit":"faf6c2a","metric":4.4,"metrics":{"elapsed_seconds":4.4},"status":"discard","description":"Hypothesis: add targeted `let` aliases in `darwinChecks` for repeated `darwinConfig` sub-atoms (system/programs/networking/services/martin, post-activation text, systemPackages) to reduce repeated deep attr-path lookups in the hot Darwin path.","timestamp":1780138548648,"segment":0,"confidence":3.5555555555555536,"asi":{"hypothesis":"`darwinChecks` had several repeated `darwinConfig.<path>` reads; hoisting these should cut attr-path traversal while preserving test coverage.","rollback_reason":"Did not outperform the current observed 4.2s envelope on this branch and appears to be neutral/noise relative to prior stable replicates; keep a cleaner state without this refactor until a stronger candidate emerges.","next_action_hint":"Prefer returning to the pre-change state used for 4.2 runs and explore candidates outside hot-path attr rewrites, or validate on a truly cold worker if this still seems potentially beneficial."}}
{"run":33,"commit":"faf6c2a","metric":4.5,"metrics":{"elapsed_seconds":4.5},"status":"discard","description":"Hypothesis: re-run the reverted baseline after a discard-edited iteration to confirm the stable 4.2 envelope is not a one-off.","timestamp":1780138557930,"segment":0,"confidence":3.9999999999999956,"asi":{"hypothesis":"If baseline continues to stay near 4.2 after config resets, this gives confidence that prior improvements are not due the discarded local aliasing.","rollback_reason":"This replicate returned 4.5s, indicating significant noise and no clear signal from the exact no-change baseline; no benchmark-guided optimization change yet.","next_action_hint":"Collect another zero-edit replicate and then decide whether to attempt a non-`darwinChecks` structural simplification or pause optimization."}}
{"run":34,"commit":"faf6c2a","metric":4.7,"metrics":{"elapsed_seconds":4.7},"status":"discard","description":"Hypothesis: perform an additional zero-edit replicate to characterize remaining variance before attempting further structural changes.","timestamp":1780138565487,"segment":0,"confidence":4,"asi":{"hypothesis":"Multiple back-to-back runs are needed to separate noise from real gains; if values stay around 4.2–4.7, optimization opportunities are likely overshadowed by environment variance.","rollback_reason":"This run was slower (4.7s), consistent with noise and not a stable incremental gain over recent baselines.","next_action_hint":"Shift focus to a different measurable structural optimization candidate outside repeated attr-path aliases, or pause and avoid further micro-changes until a clearer signal appears."}}
{"run":35,"commit":"6af08c1","metric":4.3,"metrics":{"elapsed_seconds":4.3},"status":"keep","description":"Hypothesis: reduce intermediate list construction in `homeChecks` by building `homePackageSet` in one pass directly from `homeData.packages` (`map (pkg: ...)` instead of name list + map).","timestamp":1780138581953,"segment":0,"confidence":3.9999999999999956,"asi":{"hypothesis":"Removing `packageNames = map lib.getName ...` should lower allocation in `homeChecks`, which is executed per-host and contributes to repeated eval cost.","rollback_reason":"","next_action_hint":"Replicate this change immediately (2–3 runs) on default-cache settings to confirm reproducibility, since prior data showed sensitivity to cache state."}}
{"run":36,"commit":"2a93ec0","metric":4.2,"metrics":{"elapsed_seconds":4.2},"status":"keep","description":"Hypothesis replication: run the one-pass `homePackageSet` implementation again to verify variance and check if the 4.3s result is repeatable.","timestamp":1780138589170,"segment":0,"confidence":3.9999999999999956,"asi":{"hypothesis":"If this optimization is real, consecutive default-cache runs should stay near 4.2–4.4 on this host without additional code changes.","rollback_reason":"N/A","next_action_hint":"Run one more replicate; if stable, treat this as the new structural candidate for this branch and consider further small package-membership micro-optimizations only if needed."}}
{"run":37,"commit":"fa575bb","metric":4.5,"metrics":{"elapsed_seconds":4.5},"status":"keep","description":"Hypothesis: third replicate to check stability of the one-pass `homePackageSet` optimization under default cache.","timestamp":1780138600860,"segment":0,"confidence":3.9999999999999956,"asi":{"hypothesis":"Even with minor variance, if this change remains below historical baseline and close to prior repeats, it likely remains worthwhile.","rollback_reason":"","next_action_hint":"With 4.2, 4.2, and 4.5 observed, move on to another low-risk optimization candidate on top of this baseline rather than further replicates."}}
{"run":38,"commit":"fa575bb","metric":4.9,"metrics":{"elapsed_seconds":4.9},"status":"discard","description":"Hypothesis: add a single `homeSkillCfg = homePrograms.agent-skills` binding in `homeChecks` and replace repeated agent-skills path lookups with this local reference for all related assertions.","timestamp":1780138617827,"segment":0,"confidence":4.571428571428569,"asi":{"hypothesis":"The previous iteration showed many repeated deep `agent-skills` attr traversals; centralizing this subtree might reduce repeated path evaluation while keeping assertions unchanged.","rollback_reason":"Run regressed to 4.9s, indicating additional local binding and replacements did not help and likely added overhead/noise under current evaluation conditions.","next_action_hint":"Revert this change and keep focus on other structural candidates; if needed, constrain agent-skills aliasing to a subset of checks only."}}
{"run":39,"commit":"fa575bb","metric":4.9,"metrics":{"elapsed_seconds":4.9},"status":"discard","description":"Hypothesis: add a lightweight Darwin home-package membership cache (`darwinHomePackageSet` + `hasDarwinHomePackage`) and reuse `darwinSystemPackages` aliases for system-package assertions in `darwinChecks`.","timestamp":1780138656165,"segment":0,"confidence":5.333333333333336,"asi":{"hypothesis":"`darwin`-path package assertions currently scan home package lists three times and touch activation system packages repeatedly; localizing these lookups should reduce repeated linear scans and attr lookups in this hot branch.","rollback_reason":"Introduced overhead from additional let structure and set build; runtime regressed to 4.9s, so this change is not beneficial in practice.","next_action_hint":"Revert and continue from one-pass `homePackageSet` baseline. If further package-optimization is needed, prefer low-risk changes that avoid extra per-host set construction in `darwinChecks`."}}
{"run":40,"commit":"fa575bb","metric":4.8,"metrics":{"elapsed_seconds":4.8},"status":"discard","description":"Hypothesis: zero-change validation after revert to confirmed baseline (`homeChecks` one-pass conversion) to re-anchor timing and confirm whether prior 4.2 runs were warm-cache outliers.","timestamp":1780138674587,"segment":0,"confidence":4.571428571428575,"asi":{"hypothesis":"This run tests whether the one-pass `homePackageSet` wins are stable without further edits or control over cache state.","rollback_reason":"Observed 4.8s, indicating significant variance and weakening confidence in sustained sub-4.3 behavior under this session's cache state.","next_action_hint":"Run one more baseline replicate; if still above 4.7, proceed with no further structural edits and treat 4.8+ as operating range while waiting for native Linux measurements."}}
{"run":41,"commit":"fa575bb","metric":4.9,"metrics":{"elapsed_seconds":4.9},"status":"discard","description":"Hypothesis: second zero-change baseline replicate to assess whether one-pass set conversion remains a sustained gain in this cache state.","timestamp":1780138682233,"segment":0,"confidence":4.000000000000004,"asi":{"hypothesis":"Consistent 4.8–4.9 would indicate the earlier 4.2 numbers were likely transient cache/cache-layout effects rather than repeatable optimization deltas.","rollback_reason":"Second replicate landed at 4.9s, so this run did not reinforce the earlier faster baselines; no structural change to keep on this data alone.","next_action_hint":"Pause micro-optimization attempts until the environment is stable (e.g., native Linux runner or fresh worker) and log this as a deferred investigation path."}}
{"run":42,"commit":"fa575bb","metric":2.4,"metrics":{"elapsed_seconds":2.4},"status":"discard","description":"Hypothesis: confirm that native-Linux integration check measurement is still blocked on this host even after subsequent expression edits; validate that failure is environmental/platform-specific, not due current working-tree changes.","timestamp":1780138689859,"segment":0,"confidence":4.571428571428575,"asi":{"hypothesis":"Cross-system check invocation on aarch64-darwin should continue to fail with platform-mismatch in the agent-skills bundle path; confirming prevents wasting cycles on Linux-only optimization validation here.","rollback_reason":"Run failed due platform mismatch while attempting to evaluate `checks.x86_64-linux.integration-configurations-eval` on an aarch64-darwin machine; no code change to evaluate.","next_action_hint":"Continue Linux-specific optimization validation only on native Linux runner; keep aarch64-darwin loop focused on default-cache Darwin checks."}}
{"run":43,"commit":"fa575bb","metric":2.3,"metrics":{"elapsed_seconds":2.3},"status":"discard","description":"Hypothesis: use `nix build --system x86_64-linux` to get Linux baseline timing directly from this host despite prior native-eval mismatch, allowing Linux-side optimization validation without native Linux runner.","timestamp":1780139033136,"segment":0,"confidence":5.333333333333336,"asi":{"hypothesis":"Forcing the build system to `x86_64-linux` should bypass earlier platform-mismatch and return a Linux-equivalent benchmark path to validate integration-check deltas.","rollback_reason":"Cross-system attempt failed due builder-side error while evaluating `agent-skills-source` derivation (`Undefined error: 0` from bash), so no valid timing comparison for optimization state was obtained.","next_action_hint":"Keep Darwin baseline loop here until a native Linux environment is available, and avoid consuming budget on non-deterministic cross-system probes unless the Linux runner path is validated."}}
{"run":44,"commit":"fa575bb","metric":4.8,"metrics":{"elapsed_seconds":4.8},"status":"discard","description":"Hypothesis: collect another default-cache Darwin baseline replicate after cross-system probing to confirm we are still in the 4.8–4.9 operational envelope before deciding on further edits.","timestamp":1780139047303,"segment":0,"confidence":4.571428571428575,"asi":{"hypothesis":"After failed Linux-probe attempts, a fresh default Darwin replicate should indicate whether recent changes still hold; if stable at ~4.8, environment variance likely dominates tiny sub-5 improvements.","rollback_reason":"This run stayed within the recent 4.8-4.9 envelope and does not establish a clear new structural signal.","next_action_hint":"Run one more replicate only if needed; otherwise defer further edits until a clear, repeatable sub-4.3 gain appears or native Linux context is available."}}
{"run":45,"commit":"fa575bb","metric":4.8,"metrics":{"elapsed_seconds":4.8},"status":"discard","description":"Hypothesis: perform one final short default-cache Darwin replicate before pausing to confirm steady-state timing after repeated control runs and cross-system failures.","timestamp":1780139067458,"segment":0,"confidence":4.000000000000004,"asi":{"hypothesis":"A final replicate should show whether the 4.8–4.9 timing is stable; stability would validate no immediate structural path forward on this host.","rollback_reason":"Result remained 4.8s; no better than recent baseline and still too noisy to justify further micro-optimization here.","next_action_hint":"Hold edits, keep this working branch unchanged, and schedule Linux-native benchmark when a compatible runner is available before attempting additional code-level changes."}}
{"run":46,"commit":"fa575bb","metric":4.2,"metrics":{"elapsed_seconds":4.2},"status":"discard","description":"Hypothesis: another default-cache Darwin replicate after a sequence of 4.8 runs to test cache-thaw behavior; if this hits 4.2, variance may be largely runtime-state dependent.","timestamp":1780139080152,"segment":0,"confidence":4.571428571428575,"asi":{"hypothesis":"If this 4.2 result is reproducible, the check appears capable of a much lower floor than recent 4.8 values once caches/JIT state align; no code changes made.","rollback_reason":"Result did not establish a consistent trend by itself and is likely another cache-state sample; cannot conclude optimization gain without sustained repeats.","next_action_hint":"Run at least one additional replicate immediately; if second run is still ~4.2 then treat current branch as stable and defer edits until structural ideas from Linux-side are available."}}
{"run":47,"commit":"174098c","metric":4.1,"metrics":{"elapsed_seconds":4.1},"status":"keep","description":"Hypothesis: a third consecutive default-cache replicate to confirm the 4.2 sample was not a fluke and capture the practical best-case under current evaluation state.","timestamp":1780139094360,"segment":0,"confidence":5.6666666666666705,"asi":{"hypothesis":"If this and the prior 4.2 run are repeated, the effective benchmark floor on this host may be ~4.1s, making further micro-optimizations potentially low-value without Linux validation.","rollback_reason":"","next_action_hint":"Run one more replicate; if 4.1 persists, lock this as baseline plateau for this environment and prioritize Linux-native validation before additional edits."}}
{"run":48,"commit":"100c219","metric":4,"metrics":{"elapsed_seconds":4},"status":"keep","description":"Hypothesis: confirm sustained best-case by one more replicate after two prior ~4.1 runs; sustained low metric would define a more realistic baseline envelope for this host.","timestamp":1780139104625,"segment":0,"confidence":5.1428571428571415,"asi":{"hypothesis":"Consecutive 4.1 then 4.0 suggests warm-cache or daemon state convergence rather than temporary blip; if repeated, this may represent practical best without code changes.","rollback_reason":"","next_action_hint":"Given 4.0 is now observed on default-cache, avoid low-risk micro-changes and proceed to Linux-native validation plan; if we continue here, only evaluate larger structural edits."}}
{"run":48,"commit":"100c219","metric":0,"metrics":{"elapsed_seconds":12.8},"status":"crash","description":"Hypothesis: validate integration-configurations-eval on a Linux target (`--system x86_64-linux`) to get native-ish timing signal and avoid Darwin-only benchmark noise. Ran `nix build --option warn-dirty false --system x86_64-linux --no-link '.#checks.x86_64-linux.integration-configurations-eval'`; build failed before producing metric due platform-specific builder failure in agent-skills source derivation.","timestamp":1780154640095,"segment":0,"confidence":10.666666666666673,"asi":{"hypothesis":"Run Linux-system integration benchmark to validate whether recent Darwin benchmark gains persist on Linux.","rollback_reason":"Build failed in `agent-skills-source` with `bash: Undefined error: 0`, so no valid benchmark measurement exists.","next_action_hint":"Run this check on a native Linux runner (or isolate/fix the cross-system `agent-skills-source` derivation) before continuing tuning.","error":"Cannot build '/nix/store/3c76jdrybjcj1qpc3wv2x66gl9r3jas8-agent-skills-source-9f66e73867cfe4e096c968b077e07059-safe.drv'. Reason: builder failed with exit code 1. Last log: executing bash: Undefined error: 0"}}
