{"run":70,"commit":"46fe42f","metric":4.9,"metrics":{"elapsed_seconds":4.9},"status":"discard","description":"Hypothesis: after a prior full-bundle crash and noisy samples, re-establish a valid single-target baseline to ensure we still have a trustworthy anchor before attempting more workload-representative commands. It returned 4.9s, acceptable for a noisy state but above the best recent 4.x envelope.","timestamp":1780155204338,"segment":0,"confidence":9.428571428571415}
